PubMed ID,Details
39567222,"1. HIV Med. 2024 Nov 20. doi: 10.1111/hiv.13737. Online ahead of print.

Comparing short-term mortality between people with and without HIV admitted to 
the intensive care unit: A single-centre matched cohort study (2000-2019).

Bakewell N(1)(2), Kanitkar T(3)(4), Dissanayake O(4), Symonds M(4), Rimmer S(3), 
Adlakha A(3), Lipman MC(4)(5)(6), Bhagani S(4), Agarwal B(3), Miller RF(4)(7), 
Sabin CA(1)(2).

Author information:
(1)Institute for Global Health, University College London, London, UK.
(2)National Institute for Health and Care Research (NIHR) Health Protection 
Research Unit (HPRU) in Blood Borne and Sexually Transmitted Infections, 
University College London, London, UK.
(3)Intensive Care Unit, Royal Free Hospital, Royal Free London NHS Foundation 
Trust, London, UK.
(4)HIV Services, Royal Free Hospital, Royal Free London NHS Foundation Trust, 
London, UK.
(5)UCL Respiratory, Division of Medicine, University College London, London, UK.
(6)Respiratory Medicine, Royal Free Hospital, Royal Free London NHS Foundation 
Trust, London, UK.
(7)Centre for Clinical Research in Infection and Sexual Health, Institute for 
Global Health, University College London, London, UK.

OBJECTIVES: The survival rate of people with HIV admitted to intensive care 
units (ICUs) is approaching that of people without HIV. We conducted a 
matched-cohort study of people with and without HIV admitted to ICU at a large 
hospital to compare short-term mortality, during 2000-2019.
METHODS: People with HIV were matched to people without HIV (1:2) on age, sex, 
admission year and Acute Physiology and Chronic Health Evaluation (APACHE)-II 
score. Applying logistic regression models fitted using independence estimating 
equations, we describe population-averaged associations of HIV with short-term 
(in-ICU, in-hospital) mortality during a patient's first admission to ICU, and 
explore whether these varied by year.
RESULTS: A total of 177 people with HIV were matched to 354 people without HIV 
(71.2% vs. 71.2% male; median age: 47 vs. 48 years, median APACHE-II: 18 vs. 17, 
median admission year: 2013 vs. 2013). Among people with HIV, 73.4% were on 
antiretroviral therapy, 51.2% had HIV-RNA ≤50 copies/mL and median CD4 T-cell 
count was 132 cells/ μ L. People with HIV had higher in-ICU (24.3% vs. 15.3%) 
and in-hospital (31.6% vs. 20.1%) mortality. People with HIV had 1.69-fold 
higher odds (95% confidence interval: 1.03-2.76) of in-ICU mortality and 1.86 
(1.19-2.91) higher odds of in-hospital mortality than people without HIV, 
adjusted for age, sex, year and APACHE-II. There was no evidence that these 
associations varied by year (p-interaction-in-ICU = 0.90; 
p-interaction-in-hospital = 0.46).
CONCLUSIONS: Our findings suggest that although outcomes have improved over 
time, people with HIV continue to have higher short-term in-ICU and in-hospital 
mortality following ICU admission compared with people without HIV with similar 
characteristics.

© 2024 The Author(s). HIV Medicine published by John Wiley & Sons Ltd on behalf 
of British HIV Association.

DOI: 10.1111/hiv.13737
PMID: 39567222"
39544616,"1. Cureus. 2024 Oct 15;16(10):e71534. doi: 10.7759/cureus.71534. eCollection 2024
 Oct.

Non-COVID Admissions to the ICU After COVID Vaccination: A Multicenter Study.

Havaldar AA(1), Sheshala K(2), Kumar R(3), Chennabasappa A(4), Thomas RR(1), 
Selvam S(5).

Author information:
(1)Critical Care Medicine, St. John's Medical College Hospital, Bengaluru, IND.
(2)Critical Care Medicine, Yashoda Hospital, Hyderabad, IND.
(3)Anesthesiology, Rajendra Institute of Medical Sciences, Ranchi, IND.
(4)Critical Care Medicine, Jagadguru Sri Shivarathreeshwara Medical College and 
Hospital, Mysuru, IND.
(5)Biostatistics, St John's Research Institute, Bengaluru, IND.

INTRODUCTION: The vaccination drive for COVID-19 was launched in India after the 
authorization of ChAdOx1 nCov-19 (Covishield), an adenoviral vector vaccine, and 
BBV152 COVID-19 (Covaxin), an inactivated virus vaccine. As stated by the CDC, 
vaccine-related adverse events can happen. In this study, we aimed to assess the 
timing of the COVID vaccination and admission diagnosis and their effect on ICU 
mortality. The time from vaccination can help identify adverse events directly 
related to vaccination.  Methods: A retrospective cohort study was conducted 
across four centers in India. Patients who took the first or second dose of any 
vaccines and were admitted with non-COVID illness to the ICU were included in 
the study. Patients were categorized based on the time interval from vaccination 
as ≤42 days or >42 days. The primary outcome was ICU mortality. The secondary 
outcomes were the length of ICU stay and duration of mechanical ventilation.
RESULTS: A total of 175 patients were included in the study. The mean age was 
53.49 (15.89) years, and 61.14% were males. The ICU mortality was 24.57% (18.38% 
to 31.63%). Thromboembolic events such as acute coronary syndrome (ACS), 
cerebrovascular accident (CVA), and mesenteric ischemia were seen in 7.43%, 
7.43%, and 1.14% of patients, respectively. Six patients (3.43%) developed 
neuromuscular illness. The mortality was higher in patients >66 years, followed 
by ≤35 years of age when admitted ≤42 days of vaccination (p=0.008). The 
mortality was higher in cerebrovascular disorders and was clinically significant 
(p<0.001).
CONCLUSION: Patients developed thromboembolic events and neuromuscular diseases 
requiring ICU admission post-COVID vaccination. We observed a significantly 
higher mortality in the age groups >66 years and ≤35 years when admitted within 
42 days of COVID vaccination. Patients admitted with cerebrovascular diseases 
also had higher mortality.

Copyright © 2024, Havaldar et al.

DOI: 10.7759/cureus.71534
PMCID: PMC11562690
PMID: 39544616

Conflict of interest statement: Human subjects: Consent was obtained or waived 
by all participants in this study. Institutional Ethics Committee, St. John's 
Medical College Hospital issued approval 149/2021. Animal subjects: All authors 
have confirmed that this study did not involve animal subjects or tissue. 
Conflicts of interest: In compliance with the ICMJE uniform disclosure form, all 
authors declare the following: Payment/services info: All authors have declared 
that no financial support was received from any organization for the submitted 
work. Financial relationships: All authors have declared that they have no 
financial relationships at present or within the previous three years with any 
organizations that might have an interest in the submitted work. Other 
relationships: All authors have declared that there are no other relationships 
or activities that could appear to have influenced the submitted work."
39540730,"1. Eur J Cardiothorac Surg. 2024 Nov 14:ezae410. doi: 10.1093/ejcts/ezae410.
Online  ahead of print.

Intensive care unit admissions following enhanced recovery video-assisted 
thoracoscopic surgery lobectomy.

Visby L(1), Secher EL(2), Møller-Sørensen H(2), Kehlet H(3), Petersen RH(1).

Author information:
(1)Department of Cardiothoracic Surgery, Copenhagen University Hospital, 
Rigshospitalet, Denmark.
(2)Department of Cardiothoracic Anesthesiology, The Heart Centre, 
Rigshospitalet, Denmark.
(3)Section of Surgical Pathophysiology, Copenhagen University Hospital, 
Rigshospitalet, Denmark.

OBJECTIVES: Video-assisted thoracoscopic surgery (VATS) lobectomy combined with 
enhanced recovery after surgery (ERAS) protocols has improved postoperative 
outcomes, yet concerns persist regarding complications and readmissions. Limited 
research has explored intensive care unit (ICU) admissions and outcomes within 
this context. This study aimed to analyze ICU admissions following VATS 
lobectomy within an established ERAS protocol.
METHODS: Consecutive patients who underwent VATS lobectomy between 2018-2023 
were included. Patient data were obtained from our prospective institutional 
database, while ICU data were extracted from electronic patients' records.
RESULTS: Of 2099 patients included, 48 (2.3%) required ICU admission. Median-age 
was 70 (IQR : 64-76), with ICU patients being older and predominantly male 
(73%). Overall 30-day-mortality was 1.0% with an ICU mortality of 31%. Multiple 
logistic regression revealed significant associations between ICU admission and 
male gender (p = <0.001), diabetes mellitus (p = 0.026), heart failure 
(p = 0.040), DLCO%(0.013). Median time to ICU admission was 4 days (IQR : 2-10). 
Respiratory failure was the primary reason for ICU admission (60%). Severe 
surgical complications accounted for 8.3% of all ICU-admissions.
CONCLUSIONS: In an ERAS setting, the incidence of ICU admission following VATS 
lobectomy was 2.3%, with a mortality rate of 31%. Respiratory failure was the 
leading cause of ICU admission.

© The Author(s) 2024. Published by Oxford University Press on behalf of the 
European Association for Cardio-Thoracic Surgery. All rights reserved.

DOI: 10.1093/ejcts/ezae410
PMID: 39540730"
39529062,"1. BMC Pulm Med. 2024 Nov 11;24(1):561. doi: 10.1186/s12890-024-03384-0.

Long-term results of intensive care patients with post-intubation tracheal 
stenosis: 7 years follow-up.

Küçük O(1), Aydemir S(2), Zengіn M(3), Alagöz A(1).

Author information:
(1)Department of Anesthesiology and Reanimation, University of Health Sciences, 
Ankara Atatürk Sanatoryum Training and Research Hospital, Keçiören, Ankara, 
Turkey.
(2)Department of Anesthesiology and Reanimation, University of Yıldırım Beyazıt, 
Yenimahalle Training and Research Hospital, Yenimahalle, Ankara, Turkey. 
drsemihaydemir@gmail.com.
(3)Department of Anesthesiology and Reanimation, University of Health Sciences, 
Ankara Etlik City Hospital, Etlik, Ankara, Turkey.

BACKGROUND/AIM: Benign tracheal stenosis (TS) is a potentially life-threatening 
condition caused by iatrogenic events resulting from endotracheal intubation and 
tracheostomy. The study aimed to determine the clinical characteristics, 
management, and long-term outcomes of patients with simple or complex 
post-intubation tracheal stenosis (PITS) who were admitted to the intensive care 
unit (ICU).
MATERIALS AND METHODS: Retrospective analysis of patients admitted to the ICU 
between June 2016 and June 2022 and diagnosed with PITS were performed until 
June 2023.
RESULTS: 76 patients (mean age 54.9 ± 17.3%, 63.2% male, 61.8% complex stenosis) 
admitted to the ICU were analysed. The diagnosis of PITS was made by fiberoptic 
bronchoscopy (FOB) in 53.9% and computed tomography (CT) in 46.1%. The most 
common location of stenosis was the upper trachea area (57.9%, n = 44). The 
median stenosis length of the TS was 1.9 cm (median 2 cm for complex stenosis, 
1 cm for simple stenosis, p < 0.001). Complex stenosis was associated with 
longer intubation time and multiple intubation history (p = 0.011, p = 0.028). 
At the same; complex stenosis was associated with prolonged and high stenosis 
percentage (p < 0.001). While dilatation and cryotherapy were sufficient for 
treatment in all patients with simple stenosis, the stent was applied to 34% 
patients with complex stenosis. Recurrence was higher in complex stenosis after 
bronchoscopic procedure (complex stenosis 95.7%, simple stenosis 17.2%). 19 
(25%) patients required surgical operation, and all of these patients had 
complex stenosis (p < 0.001). Median follow-up was 33 months for simple stenosis 
and 34 months for complex stenosis. ICU length of stay (LOS) was longer in 
patients with complex stenosis. There was no statistically significant 
difference between TS classes in terms of ICU mortality (p = 0.466), 1-year 
mortality (p = 0.951), and mortality during follow-up (p = 0.608).
CONCLUSION: PITS is a challenging situation in ICU patients. In patients with a 
preliminary diagnosis of PITS, bronchoscopy should be performed without delay, 
and it should be known that interventional bronchoscopy is not only a diagnostic 
tool but an effective strategy in treatment management after the diagnosis is 
finalised. The advantage of interventional bronchoscopy is that it alleviates 
symptoms that necessitate hospitalisation in the ICU and eliminates the need for 
ICU of patients.

© 2024. The Author(s).

DOI: 10.1186/s12890-024-03384-0
PMCID: PMC11552334
PMID: 39529062 [Indexed for MEDLINE]

Conflict of interest statement: Declarations Ethics approval and consent to 
participate Approval was obtained from the ethics committee at the University of 
Yıldırım Beyazıt, Yenimahalle Training and Research Hospital Clinical Research 
(protocol number E-2023-52; dated 11/10/2023). Yenimahalle Training and Research 
Hospital Clinical Research Ethics Committee waived the need for informed consent 
because the current study was retrospective. All procedures performed in studies 
involving human participants were in accordance with the ethical standards of 
the institutional and/or national research committee and with the 1964 Helsinki 
declaration (as revised in 2013) and its later amendments or comparable ethical 
standards. Consent for publication Not applicable. Competing interests The 
authors declare no competing interests."
39507229,"1. Aging Med (Milton). 2024 Oct 18;7(5):580-587. doi: 10.1002/agm2.12358. 
eCollection 2024 Oct.

Short-term mortality among very elderly cancer patients in the intensive care 
unit: A retrospective cohort study based on the Medical Information Mart for 
Intensive Care IV database.

Liu T(1), Ding R(2).

Author information:
(1)Department of Surgical Intensive Care Unit, Beijing Hospital, National Center 
of Gerontology, Institute of Geriatric Medicine Chinese Academy of Medical 
Sciences Beijing China.
(2)Department of Surgical Intensive Care Unit, Fuwai Hospital, National Center 
of Cardiovascular Diseases Chinese Academy of Medical Sciences and Peking Union 
Medical College Beijing China.

OBJECTIVE: The objective of this study is to examine the epidemiological 
characteristics of very elderly patients (aged over 80 years) with cancer 
admitted to the intensive care unit (ICU), and to elucidate the association 
between Acute Physiology Score III (APS-III) and 28-day mortality.
METHOD: A retrospective analysis was conducted using data extracted from the 
Medical Information Mart for Intensive Care IV (MIMIC-IV) database. Patients 
aged 80 years and above were assigned to three groups: non-cancer group, 
non-metastatic cancer group, and metastatic cancer group, based on their cancer 
diagnosis and its extent, Kaplan-Meier curves were constructed among these 
patient groups. Furthermore, patients were divided into a survival group and a 
non-survival group based on their 28-day survival status after ICU admission. 
Univariate and multivariate logistic regression analyses were performed to 
detect the risk factors for 28-day mortality among these patients. Additionally, 
this investigation sought to establish a dose-response relationship by exploring 
the graded association between APS-III scores and the 28-day mortalities among 
patients diagnosed with cancer.
RESULTS: A total of 42,037 medical records were screened, from which 11,461 
elderly patients aged over 80 years were included, comprising 1020 (8.90%) with 
non-metastatic cancer, 537 (4.68%) with metastatic cancer, and 9904 (86.41%) 
without cancer. Significant differences in 28-day mortality were observed 
between both the non-metastatic and metastatic cancer groups compared to the 
non-cancer group (20.98% and 22.35% vs. 15.75%, p < 0.001). However, no 
statistically significant difference was detected in the 28-day mortality rate 
when comparing the non-metastatic cancer group directly with the metastatic 
cancer group (20.98% vs. 22.35%, p = 0.576). Univariate analysis revealed 
significant differences (p < 0.001) in age, gender, BMI, aCCI excluding cancer 
point, ventilation, presence of cancer, and status of metastatic cancer between 
the survival and non-survival groups. In the multivariate logistic regression, 
the odds ratio (OR) for ventilation was found to be 2.154 (95% CI: 1.799-2.578), 
cancer conferred an OR of 1.499 (95% CI: 1.137-1.975), metastatic cancer showed 
an OR of 1.171 (95% CI: 0.745-1.841), APS-III showed an OR of 1.038 (95% CI: 
1.034-1.042). A dose-response relationship was observed, demonstrating that when 
the APS-III score exceeded 80 points, the 28-day mortality rate surpassed 50% 
among the very elderly cancer patients in ICU.
CONCLUSIONS: More than one-tenth of critically ill very elderly patients 
admitted to the ICU are diagnosed with cancer. Among ICU patients, those with 
cancer face a short-term mortality risk approximately 1.5 times higher than 
those without a cancer diagnosis. Interestingly, while our findings do not 
indicate an escalated mortality risk due to metastasis within the cancer patient 
cohort, the presence of cancer itself remains a significant factor influencing 
ICU mortality rates in this very elderly population.

© 2024 The Author(s). Aging Medicine published by Beijing Hospital and John 
Wiley & Sons Australia, Ltd.

DOI: 10.1002/agm2.12358
PMCID: PMC11535163
PMID: 39507229

Conflict of interest statement: The authors declare that they have no conflict 
of interests."
39497221,"1. Pneumonia (Nathan). 2024 Nov 5;16(1):27. doi: 10.1186/s41479-024-00144-w.

Epidemiology, clinical and biological characteristics, and prognosis of 
critically ill COVID 19 patients: a single-center experience through 4 
successive waves.

Tchakerian S(1), Besnard N(1), Brunot V(1), Moulaire V(1), Benchabane N(1), 
Platon L(1), Daubin D(1), Corne P(1), Machado S(1), Jung B(1)(2), Bendiab E(1), 
Landreau L(1), Pelle C(1), Larcher R(1), Klouche K(3)(4).

Author information:
(1)Department of Intensive Care Medicine, Lapeyronie University Hospital, 
University of Montpellier, 371 Avenue du Doyen Gaston Giraud, 34295, 
Montpellier, France.
(2)PhyMedExp, INSERM (French Institute of Health and Medical Research), CNRS 
(French National Centre for Scientific Research), University of Montpellier, 
School of Medicine, Montpellier, France.
(3)Department of Intensive Care Medicine, Lapeyronie University Hospital, 
University of Montpellier, 371 Avenue du Doyen Gaston Giraud, 34295, 
Montpellier, France. k-klouche@chu-montpellier.fr.
(4)PhyMedExp, INSERM (French Institute of Health and Medical Research), CNRS 
(French National Centre for Scientific Research), University of Montpellier, 
School of Medicine, Montpellier, France. k-klouche@chu-montpellier.fr.

OBJECTIVE: The aim of this study was to describe the characteristics of patients 
admitted to the intensive care unit with severe pneumonia due to SARS-CoV-2, 
comparing them according to successive waves, and to identify prognostic factors 
for morbidity and mortality.
MATERIALS AND METHODS: This single-center retrospective observational 
descriptive study was conducted from March 10, 2020, to October 17, 2021. All 
adult patients admitted with SARS-CoV-2 pneumonia presenting acute respiratory 
failure were included. COVID 19 diagnosis was confirmed by RT-PCR testing of 
respiratory specimens. The primary endpoint was ICU mortality. Secondary 
endpoints were the occurrence of ventilator-associated pneumonia (VAP) or 
bronchopulmonary aspergillosis.
RESULTS: Over the study period, 437 patients were included of whom 282 (65%) 
patients were ventilated for 9 [5;20] days. Among the studied population, 38% 
were treated for one or more episodes of VAP, and 22 (5%) for bronchopulmonary 
aspergillosis. ICU mortality was 26% in the first wave, then fell and stabilized 
at around 10% in subsequent waves (p = 0.02). Increased age, Charlson index, 
SOFA score and lactatemia on admission were predictive of mortality. Survival at 
90 days was 85% (95% CI 82-88) and was unaffected by the presence of VAP. 
However, the occurrence of bronchopulmonary aspergillosis increased mortality to 
36%.
CONCLUSION: In this study, we observed mortality in the lower range of those 
previously reported. Risk factors for mortality mainly included age and previous 
comorbidities. The prognosis of these critically ill Covid 19 patients improved 
over the four waves, underlining the likely beneficial effect of vaccination and 
dexamethasone.

© 2024. The Author(s).

DOI: 10.1186/s41479-024-00144-w
PMCID: PMC11536821
PMID: 39497221

Conflict of interest statement: The authors declare no competing interests."
39496882,"1. Neurocrit Care. 2024 Nov 5. doi: 10.1007/s12028-024-02150-8. Online ahead of 
print.

The Predictive Validity of the Full Outline of UnResponsiveness Score Compared 
to the Glasgow Coma Scale in the Intensive Care Unit: A Systematic Review.

Schey JE(1)(2)(3), Schoch M(4)(5), Kerr D(4)(5)(6).

Author information:
(1)School of Nursing and Midwifery, Faculty of Health, Deakin University, 
Geelong, VIC, Australia. Jaime.schey@deakin.edu.au.
(2)Intensive Care Unit, Royal Melbourne Hospital, Melbourne, VIC, Australia. 
Jaime.schey@deakin.edu.au.
(3)Centre for Quality and Patient Safety Research, School of Nursing and 
Midwifery, Institute for Health Transformation, Deakin University, Geelong, VIC, 
Australia. Jaime.schey@deakin.edu.au.
(4)School of Nursing and Midwifery, Faculty of Health, Deakin University, 
Geelong, VIC, Australia.
(5)Centre for Quality and Patient Safety Research, School of Nursing and 
Midwifery, Institute for Health Transformation, Deakin University, Geelong, VIC, 
Australia.
(6)Deakin University, Western Health Partnership, St Albans, VIC, Australia.

The Full Outline of UnResponsiveness (FOUR) score was developed to overcome the 
limitations of the Glasgow Coma Scale (GCS) when assessing individuals with 
impaired consciousness. We sought to review the evidence regarding the 
predictive validity of the GCS and FOUR score in intensive care unit (ICU) 
settings. This review was prospectively registered in PROSPERO (CRD42023420528). 
Systematic searches of CINAHL, MEDLINE, and Embase were undertaken. Prospective 
observational studies were included if both GCS and FOUR score were assessed in 
adults during ICU admission and if mortality and/or validated functional outcome 
measure scores were collected. Studies were excluded if they exclusively 
investigated patients with traumatic brain injury. Screening, data extraction, 
and quality assessment using the Quality in Prognosis Studies tool were 
conducted by two reviewers. Twenty studies of poor to moderate quality were 
included. Many studies only included patients with neurological illness and 
excluded sedated patients, despite high proportions of intubated patients. The 
FOUR score achieved higher area under the receiver operating characteristic 
curve values for mortality prediction compared with the GCS, and the FOUR score 
achieved significantly higher area under the receiver operating characteristic 
curve values for predictions of ICU mortality. Both coma scales showed similar 
accuracy in predicting ""unfavorable"" functional outcome. The FOUR score appeared 
to be more responsive than the GCS in the ICU, as most patients with a GCS score 
of 3 obtained FOUR scores between 1 and 8 due to preserved brainstem function. 
The FOUR score may be superior to the GCS for predicting mortality in ICU 
settings. Further adequately powered studies with clear, reliable methods for 
assessment of index and outcome scores are required to clarify the predictive 
performance of both coma scales in ICUs. Inclusion of sedated patients may 
improve generalizability of findings in general ICU populations.

© 2024. The Author(s).

DOI: 10.1007/s12028-024-02150-8
PMID: 39496882"
