PubMed ID,Details
39375738,"1. Eur J Med Res. 2024 Oct 7;29(1):491. doi: 10.1186/s40001-024-02082-1.

Impact of mechanical power on ICU mortality in ventilated critically ill 
patients: a retrospective study with continuous real-life data.

Manrique S(#)(1)(2)(3), Ruiz-Botella M(#)(4), Murillo N(5), Canelles S(5), 
Victoria ID(5), Samper MA(5), Plans O(5), Claverias L(5)(6), Magret M(5), Gordo 
F(7), Roca O(8)(9), Bodí M(5)(6)(9).

Author information:
(1)Critical Care Department, Hospital Universitario Joan XXIII, Mallafré Guasch 
4, 43005, Tarragona, Spain. smanriquemoreno@gmail.com.
(2)Instituto de Investigación Sanitaria Pere i Virgili, Universidad Rovira i 
Virgili, Tarragona, Spain. smanriquemoreno@gmail.com.
(3)Rovira i Virgili University, Tarragona, Spain. smanriquemoreno@gmail.com.
(4)Departament of Chemical Engineering, Universitat Rovira i Virgili, Tarragona, 
Spain.
(5)Critical Care Department, Hospital Universitario Joan XXIII, Mallafré Guasch 
4, 43005, Tarragona, Spain.
(6)Instituto de Investigación Sanitaria Pere i Virgili, Universidad Rovira i 
Virgili, Tarragona, Spain.
(7)Critical Care Department, Hospital Universitario del Henares, Coslada, 
Madrid, Spain.
(8)Critical Care Department, Parc Taulí Hospital Universitari, Parc del Taulí 1, 
08028, Sabadell, Spain.
(9)Centro de Investigación Biomédica en Red de Enfermedades Respiratorias 
(CIBERES), Instituto de Salud Carlos III, Madrid, Spain.
(#)Contributed equally

BACKGROUND: Over the past decade, numerous studies on potential factors 
contributing to ventilation-induced lung injury have been carried out. 
Mechanical power has been pointed out as the parameter that encloses all 
ventilation-induced lung injury-contributing factors. However, studies conducted 
to date provide data regarding mechanical power during the early hours of 
mechanical ventilation that may not accurately reflect the impact of power 
throughout the period of mechanical ventilatory support on intensive care unit 
mortality.
METHODS: Retrospective observational study conducted at a single center in 
Spain. Patients admitted to the intensive care unit, > o = 18 years of age, and 
ventilated for over 24 h were included. We extracted the mechanical power values 
throughout the entire mechanical ventilation in controlled modes period from the 
clinical information system every 2 min. First, we calculate the cutoff-point 
for mechanical power beyond which there was a greater change in the probability 
of death. After, the sum of time values above the safe cut-off point was 
calculated to obtain the value in hours. We analyzed if the number of hours the 
patient was under ventilation with a mechanical power above the safe threshold 
was associated with intensive care unit mortality, invasive mechanical 
ventilation days, and intensive care unit length of stay. We repeated the 
analysis in different subgroups based on the degree of hypoxemia and in patients 
with SARS CoV-2 pneumonia.
RESULTS: The cut-off point of mechanical power at with there is a higher 
increase in intensive care unit mortality was 18 J/min. The greater the number 
of hours patients were under mechanical power > 18 J/min the higher the 
intensive care unit mortality in all the study population, in patients with SARS 
CoV-2 pneumonia and in mild to moderate hypoxemic respiratory failure. The risk 
of death in the intensive care unit increases 0.1% for each hour with mechanical 
power exceeding 18 J/min. The number of hours with mechanical power > 18 J/min 
also affected the days of invasive mechanical ventilation and intensive care 
unit length of stay.
CONCLUSIONS: The number of hours with mechanical power > 18 J/min is associated 
with mortality in the intensive care unit in critically ill patients. Continuous 
monitoring of mechanical power in controlled modes using an automated clinical 
information system could alert the clinician to this risk.

© 2024. The Author(s).

DOI: 10.1186/s40001-024-02082-1
PMCID: PMC11457382
PMID: 39375738 [Indexed for MEDLINE]

Conflict of interest statement: The authors declare no competing interests."
39366492,"1. Respir Med. 2024 Oct 2;234:107823. doi: 10.1016/j.rmed.2024.107823. Online
ahead  of print.

Severe community-acquired pneumonia at a tertiary academic hospital in 
Johannesburg, South Africa.

Venturas JP(1), Richards GA(2), Feldman C(3).

Author information:
(1)Department of Internal Medicine, Faculty of Health Sciences, University of 
the Witwatersrand Medical School, Johannesburg, South Africa. Electronic 
address: jpventuras@gmail.com.
(2)Dept of Surgery, Division of Critical Care, Faculty of Health Sciences, 
University of the Witwatersrand, Johannesburg, South Africa. Electronic address: 
Guy.richards@wits.ac.za.
(3)Department of Internal Medicine, Faculty of Health Sciences, University of 
the Witwatersrand Medical School, Johannesburg, South Africa. Electronic 
address: charles.feldman@wits.ac.za.

PURPOSE: There is a paucity of data from sub-Saharan Africa describing Severe 
Community Acquired Pneumonia (SCAP), a condition with significant morbidity and 
mortality.
MATERIALS AND METHODS: This was a retrospective, single-centre, observational 
study of consecutive patients with SCAP admitted to the ICU at Charlotte Maxeke 
Johannesburg Academic Hospital, in South Africa between 1 July 2007 and 31 May 
2019. Pneumonia was categorised as community-acquired if there had been no 
hospitalization in the preceding 2 weeks.
RESULTS: We identified 931 patients, (median age 37 [IQR 30-48] years), with the 
predominant co-morbidity being HIV co-infection (77.1 %). The median CURB-65 and 
APACHE II scores were 3 (IQR 2-3) and 18 (IQR 14-23) respectively, and most 
patients had multilobar consolidation on chest X-ray. Mycobacterium tuberculosis 
was the most common aetiology, followed by Streptococcus pneumoniae. The latter, 
and Pneumocystis jirovecii were more common amongst survivors and non-survivors, 
respectively. ICU mortality was 50.1 % and 85 % of patients required 
ventilation, mostly invasive mechanical ventilation. Ventilated patients and 
those requiring inotropic support and/or dialysis were more likely to die.
CONCLUSION: We have described a cohort of patients with SCAP, with a 
comprehensive overview of all putative microbiological causes, which to our 
knowledge, is the largest reported in the literature.

Copyright © 2024 The Authors. Published by Elsevier Ltd.. All rights reserved.

DOI: 10.1016/j.rmed.2024.107823
PMID: 39366492

Conflict of interest statement: Declaration of competing interest CF acts on the 
Speaker's bureau of Sandoz and Aurogen. All the other authors declare that they 
have no conflict of interests in relation to this manuscript."
39362971,"1. Sci Rep. 2024 Oct 3;14(1):22954. doi: 10.1038/s41598-024-74177-y.

Acute kidney injury developed in the intensive care unit: a population-based 
prospective cohort study in the Brazilian Amazon.

Melo FAF(1), Burdmann EA(2), Macedo E(3), Mehta R(3), Zanetta DMT(4).

Author information:
(1)Division of Urology, Acre Federal University, Rio Branco, Acre, Brazil.
(2)Laboratório de Investigação (LIM) 12, Serviço de Nefrologia, Faculdade de 
Medicina da Universidade de Sao Paulo, São Paulo, Brazil.
(3)Department of Medicine, University of California San Diego (UCSD), San Diego, 
CA, USA.
(4)Department of Epidemiology, School of Public Health, University of São Paulo, 
São Paulo, São Paulo, Brazil. dzanetta@usp.br.

The Brazilian Amazon is a vast area with limited health care resources. To 
assess the epidemiology of critically ill acute kidney injury (AKI) patients in 
this area, a prospective cohort study of 1029 adult patients of the three 
intensive care units (ICUs) of Rio Branco city, the capital of Acre state, were 
evaluated from February 2014 to February 2016. The incidence of AKI was 53.3%. 
Risk factors for AKI included higher age, nonsurgical patients, admission to the 
ICU from the ward, higher Acute Physiology and Chronic Health Evaluation 
(APACHE) II scores at ICU admission, and positive fluid balance > 1500 ml/24 
hours in the days before AKI development in the ICU, with aOR of 1.3 (95% CI 
1.03-1.23), 1.47 (95% CI 1.07-2.03), 1.96 (95% CI 1.40-2.74), 1.05 (95% CI 
1.03-1.08) for each unit increase, and 1.62 (95% CI 1.16-2.26), respectively. 
AKI was associated with higher ICU mortality (aOR 2.03, 95% CI 1.29-3.18). AKI 
mortality was independently associated with higher age, nonsurgical patients, 
sepsis at ICU admission, presence of shock or use of vasoactive drugs, 
mechanical ventilation and mean positive fluid balance in the ICU > 1500 ml/24 
hours, both during ICU follow-up, with aOR 1.27 (95% CI 1.14-1.43) for each 
10-year increase, 1.64 (95% CI 1.07-2.52), 2.35 (95% CI 1.14-4.83), 1.88 (95% CI 
1.03-3.44), 6.73 (95% CI 4.08-11.09), 2.31 (95% CI 1.52-3.53), respectively. 
Adjusted hazard ratios for AKI mortality 30 and 31-180 days after ICU discharge 
were 3.13 (95% CI 1.84-5.31) and 1.69 (95% CI 0.99-2.90), respectively. AKI 
incidence was strikingly high among critically ill patients in the Brazilian 
Amazon. The AKI etiology, risk factors and outcomes were similar to those 
described in high-income countries, but mortality rates were higher.

© 2024. The Author(s).

DOI: 10.1038/s41598-024-74177-y
PMCID: PMC11452208
PMID: 39362971 [Indexed for MEDLINE]

Conflict of interest statement: The authors declare no competing interests."
39318959,"1. Cureus. 2024 Aug 25;16(8):e67723. doi: 10.7759/cureus.67723. eCollection 2024 
Aug.

The Management and Outcomes of Septic Shock Among Surgical Patients at the Jimma 
University Medical Center, Jimma, Ethiopia: A Prospective Study.

James Oriho L(1), Tena Shale W(1), Tesfaye Woldemariam S(2).

Author information:
(1)Department of Surgery, College of Public Health and Medical Sciences, Jimma 
University, Jimma, ETH.
(2)Department of surgery, College of Public Health and Medical Sciences, Jimma 
University, Jimma, ETH.

Background and objective Sepsis and septic shock are major healthcare issues in 
surgical patients admitted to the surgery ward or ICU, affecting millions of 
people worldwide annually, with a mortality rate between one in three and one in 
six of those affected. The incidence and mortality of sepsis vary greatly by 
region, with the highest prevalence in Sub-Saharan Africa, Oceania, South Asia, 
East Asia, and Southeast Asia. Of all sepsis cases in 2017, 33.1 million people 
suffered from ill health due to underlying infectious diseases, and 15.8 million 
suffered from underlying injuries or non-communicable diseases.  Methods This 
prospective observational study was conducted at the Jimma University Medical 
Centre (JUMC) in Jimma town in southwest Ethiopia, from April 2023 to October 
2023. All surgical patients aged ≥15 years who presented with or developed 
septic shock at the Jimma University Medical Centre were included. Results The 
study involved a total of 61 patients. The median age of the patients was 45 
years [interquartile range (IQR): 40-60 years], and 77% (n=47) of the patients 
were male. The most frequent source of infection in this study was 
community-acquired infection (83.3%, n=49). The most common focus of sepsis was 
the intra-abdominal infection of the digestive system (82%, n=50). Lactate level 
testing and blood cultures before administering antibiotics were not done for 
all septic shock patients. Source control surgery was performed in 52.5% (n=32) 
of patients after developing septic shock, and 84.4% (n=27) of surgeries were 
performed within 24 hours. The 30-day mortality rate was 80.3%, with an ICU 
mortality rate of 78.94%. The median length of stay in the ICU was three days 
(IQR: 1-5 days), and the median length of hospital stay was six days (IQR: 2-15 
days). Conclusions The mortality rate in our cohort was higher compared to that 
in studies from high-income and low-income countries. There was poor adherence 
and compliance with the Surviving Sepsis Campaign (SSC) (the one-hour bundle) 
guidelines. The length of stay in hospitals and ICUs was lower compared to 
studies from high-income countries due to the high early mortality rates.

Copyright © 2024, James Oriho et al.

DOI: 10.7759/cureus.67723
PMCID: PMC11421308
PMID: 39318959

Conflict of interest statement: Human subjects: Consent was obtained or waived 
by all participants in this study. Jimma University Institute of Health IRB 
issued approval JUIH/IRB/538/23. Animal subjects: All authors have confirmed 
that this study did not involve animal subjects or tissue. Conflicts of 
interest: In compliance with the ICMJE uniform disclosure form, all authors 
declare the following: Payment/services info: All authors have declared that no 
financial support was received from any organization for the submitted work. 
Financial relationships: All authors have declared that they have no financial 
relationships at present or within the previous three years with any 
organizations that might have an interest in the submitted work. Other 
relationships: All authors have declared that there are no other relationships 
or activities that could appear to have influenced the submitted work."
39310058,"1. J Intensive Med. 2024 Jun 25;4(4):526-536. doi: 10.1016/j.jointm.2024.04.004. 
eCollection 2024 Oct.

Association between hyperglycemia at ICU admission and postoperative acute 
kidney injury in patients undergoing cardiac surgery: Analysis of the MIMIC-IV 
database.

Ruan J(1)(2), Huang W(1)(3), Jiang J(1)(2), Hu C(1)(2), Li Y(1)(2), Peng 
Z(1)(2), Cai S(1)(2).

Author information:
(1)Department of Critical Care Medicine, Zhongnan Hospital of Wuhan University, 
Wuhan, Hubei, China.
(2)Clinical Research Center of Hubei Critical Care Medicine, Wuhan, Hubei, 
China.
(3)Department of Critical Care Medicine, Sir Run Run Shaw Hospital, Zhejiang 
University School of Medicine, Hangzhou, Zhejiang, China.

BACKGROUND: This study aimed to explore the correlation between hyperglycemia at 
intensive care unit (ICU) admission and the incidence of acute kidney injury 
(AKI) in patients after cardiac surgery.
METHODS: We conducted a retrospective cohort study, in which clinical data were 
extracted from the Medical Information Mart for Intensive Care (MIMIC)-IV 
database. Adults (≥18 years) in the database who were admitted to the 
cardiovascular intensive care unit after cardiac surgery were enrolled. The 
primary outcome was the incidence of AKI within 7 days following ICU admission. 
Secondary outcomes included ICU mortality, hospital mortality, ICU length of 
stay, and the 28-day and 90-day mortality. Multivariable Cox regression analysis 
was used to assess the association between ICU-admission hyperglycemia and AKI 
incidence within 7 days of ICU admission. Different adjustment strategies were 
used to adjust for potential confounders. Patients were divided into three 
groups according to their highest blood glucose levels recorded within 24 h of 
ICU admission: no hyperglycemia (<140 mg/dL), mild hyperglycemia (140-200 
mg/dL), and severe hyperglycemia (≥200 mg/dL).
RESULTS: Of the 6905 included patients, 2201 (31.9%) were female, and the median 
(IQR) age was 68.2 (60.1-75.9) years. In all, 1836 (26.6%) patients had severe 
hyperglycemia. The incidence of AKI within 7 days of ICU admission, ICU 
mortality, and hospital mortality was significantly higher in patients with 
severe admission hyperglycemia than those with mild hyperglycemia or no 
hyperglycemia (80.3% vs. 73.6% and 61.2%, respectively; 2.8% vs. 0.9% and 1.9%, 
respectively; and 3.4% vs. 1.2% and 2.5%, respectively; all P <0.001). Severe 
hyperglycemia was a risk factor for 7-day AKI (Model 1: hazard ratio 
[HR]=1.4809, 95% confidence interval [CI]: 1.3126 to 1.6707; Model 2: HR=1.1639, 
95% CI: 1.0176 to 1.3313; Model 3: HR=1.2014, 95% CI: 1.0490 to 1.3760; all P 
<0.050). Patients with normal glucose levels (glucose levels <140 mg/dL) had a 
higher 28-day mortality rate than those with severe hyperglycemia (glucose 
levels ≥200 mg/dL) (4.0% vs. 3.8%, P <0.001).
CONCLUSIONS: In post-cardiac surgery patients, severe hyperglycemia within 24 h 
of ICU admission increases the risk of 7-day AKI, ICU mortality, and hospital 
mortality. Clinicians should be extra cautious regarding AKI among patients with 
hyperglycemia at ICU admission after cardiac surgery.

© 2024 The Authors. Published by Elsevier B.V. on behalf of Chinese Medical 
Association.

DOI: 10.1016/j.jointm.2024.04.004
PMCID: PMC11411430
PMID: 39310058"
39301321,"1. Front Endocrinol (Lausanne). 2024 Sep 5;15:1446714. doi: 
10.3389/fendo.2024.1446714. eCollection 2024.

Stress hyperglycemia is associated with poor prognosis in critically ill 
patients with cardiogenic shock.

Tian J(1), Zhou T(1), Liu Z(1), Dong Y(1), Xu H(1).

Author information:
(1)Department of Critical Care Medicine, The Affiliated Wuxi People's Hospital 
of Nanjing Medical University, Wuxi People's Hospital, Wuxi Medical Center, 
Nanjing Medical University, Wux, Jiangsu, China.

BACKGROUND: Stress hyperglycemia is now more common in intensive care unit (ICU) 
patients and is strongly associated with poor prognosis. Whether this 
association exists in critically ill patients with cardiogenic shock (CS) is 
unknown. This study investigated the prognostic relationship of stress 
hyperglycemia on critically ill patients with CS.
METHODS: We included 393 critically ill patients with CS from the MIMIC IV 
database in this study and categorized the patients into four groups based on 
quartiles of Stress hyperglycemia ratio (SHR). We assessed the correlation 
between SHR and mortality using restricted cubic spline analysis and Cox 
proportional hazards models. The primary outcomes observed were ICU mortality 
and hospitalization mortality.
RESULTS: The mean age of the entire study population was 68 years, of which 30% 
were male (118 cases). There was no significant difference between the four 
groups in terms of age, gender, BMI, and vital signs (P>0.05). There was an 
increasing trend in the levels of lactate (lac), white blood cell count (WBC), 
glutamic oxaloacetic transaminase (AST), glucose and Hemoglobin A1C (HbA1c) from 
group Q1 to group Q2, with the greatest change in patients in group Q4 (P<0.05) 
and the patients in group Q4 had the highest use of mechanical ventilation, the 
longest duration of mechanical ventilation, ICU stay and hospital stay. After 
adjusting for confounders, SHR was found to be strongly associated with patient 
ICU mortality, showing a U-shaped relationship.
CONCLUSION: In critically ill patients with CS, stress hyperglycemia assessed by 
SHR was significantly associated with patient ICU mortality.

Copyright © 2024 Tian, Zhou, Liu, Dong and Xu.

DOI: 10.3389/fendo.2024.1446714
PMCID: PMC11410614
PMID: 39301321 [Indexed for MEDLINE]

Conflict of interest statement: The authors declare that the research was 
conducted in the absence of any commercial or financial relationships that could 
be construed as a potential conflict of interest."
39302432,"1. Eur Heart J Acute Cardiovasc Care. 2024 Sep 20:zuae108. doi: 
10.1093/ehjacc/zuae108. Online ahead of print.

Cardiogenic shock in general intensive care unit: a Nationwide prospective 
analysis of epidemiology and outcome.

Tavazzi G(1)(2), Tricella G(3), Garbero E(3), Zamperoni A(4), Zanetti M(5), 
Finazzi S(3).

Author information:
(1)Department of Clinical-Surgical, Diagnostic and Pediatric Sciences, 
University of Pavia.
(2)Intensive Care, Fondazione Policlinico San Matteo Hospital IRCCS, Pavia, 
Italy.
(3)Laboratory of Clinical Data Science, Department of Public Health, Istituto di 
Ricerche farmacologiche Mario Negri IRCCS, Ranica, BG, Italy.
(4)Cà Foncello Hospital, AULSS2 Treviso, Treviso, Italy.
(5)Laboratory for Mother and Child Health, Department of Public Health, Istituto 
di Ricerche farmacologiche Mario Negri IRCCS, Milan, Italy.

BACKGROUND: Cardiogenic shock (CS) is a life-threatening disease burdened by a 
mortality up to 50%. The epidemiology has changed with non-ischemic aetiologies 
being predominant although data was mainly derived from patients admitted to 
dedicated acute cardiac care. We report the epidemiology and outcome of patients 
with CS admitted to general intensive care unit (ICU).
METHODS: Prospective multicentric epidemiological study including 314 general 
ICU adhering to the GiViTI Nationwide registry from 2011 to 2018, excluding 
cardiac arrest. The primary endpoint of the study was mortality. The association 
between clinical factors and mortality was evaluated using a logistic regression 
model. The Odds Ratios of the covariates quantify their association with 
mortality during hospitalization.
RESULTS: 11052 patients admitted to general ICU (incidence 2.17%; median age 72 
(IQR [66-81]), 38.7% were women) with CS were included. Fourthy-seven percent of 
patients had more than 3 organ insufficiency at the time of admission. The most 
common CS aetiologies were: left heart failure LHF- 5247-47.5%), acute 
myocardial infarction (AMI - 3612-32.6%); right heart failure (RHF- 515-4.6%) 
and biventricular failure (532- 4.8%). 85.5% were mechanically ventilated during 
the ICU hospitalization. The overall ICU mortality was 44.8%, increasing to 
53.4% during the hospitalization in the index hospital and to 54.3% at the 
latest hospital. RHF-CS patients exhibited the highest mortality risk (OR: 1.19 
95% CI [0.94 - 1.50]; p < 0.001), followed by biventricular-CS OR 1.04 95% CI 
[0.82-1.32]. Respiratory failure (OR 1.13 [95%CI 1.08-1.19]), coagulation 
disorder (1.17 (95% CI 1.1-1.24), renal dysfunction (OR 1.55 [95% CI 1.50-1.61] 
and neurological alteration (OR 1.45 [95% CI 1.39-1.50]) were associated with 
worsen outcome along with severe hypotension (systolic blood pressure < 70 mmHg- 
OR 2.35 95% CI [2.06-2.67]), increasing age (OR 2.21 95% CI [2.01-2.42] and 
longer ICU stay prior to admission (2-fold increase for each 4.7 days).
CONCLUSIONS: In the general ICU the aetiology of CS, excluding cardiac arrest, 
remains characterized mostly by LHF with RHF-CS burdened by higher mortality. 
Multiorgan failure at admission and longer hospital stay before ICU admission 
predispose to worsen outcome.

© The Author(s) 2024. Published by Oxford University Press on behalf of the 
European Society of Cardiology. All rights reserved. For commercial re-use, 
please contact reprints@oup.com for reprints and translation rights for 
reprints. All other permissions can be obtained through our RightsLink service 
via the Permissions link on the article page on our site—for further information 
please contact journals.permissions@oup.com.

DOI: 10.1093/ehjacc/zuae108
PMID: 39302432"
39285256,"1. Sci Rep. 2024 Sep 16;14(1):21605. doi: 10.1038/s41598-024-72969-w.

Association between triglyceride glucose-body mass index and all-cause mortality 
in critically ill patients with acute pancreatitis.

Zhu Y(1)(2), Li Y(3), Li X(3), Huang S(3), Li Y(4)(5).

Author information:
(1)Department of General Surgery, The Second Affiliated Hospital of Hunan Normal 
University, Changsha, 410008, Hunan, People's Republic of China.
(2)Department of General Surgery, No. 921 Hospital of the PLA Joint Logistic 
Support Force, Changsha, 410008, Hunan, People's Republic of China.
(3)National Clinical Research Center for Geriatric Disorders, Xiangya Hospital, 
Central South University, Changsha, 410008, Hunan, People's Republic of China.
(4)Department of General Surgery, The Second Affiliated Hospital of Hunan Normal 
University, Changsha, 410008, Hunan, People's Republic of China. 
13423763712@163.com.
(5)Department of General Surgery, No. 921 Hospital of the PLA Joint Logistic 
Support Force, Changsha, 410008, Hunan, People's Republic of China. 
13423763712@163.com.

This study delves into the correlation between the triglyceride glucose-body 
mass index (TyG-BMI) index upon hospital admission and clinical outcomes among 
this patient population. We investigated the association between TyG-BMI at 
hospital admission and clinical outcomes in this patient group, and analyzed 
data from the Medical Information Mart for Intensive Care IV database, 
identifying acute pancreatitis (AP) patients admitted to ICUs and stratifying 
them by TyG-BMI quartiles. We assessed the relationship between TyG-BMI and 
mortality (both in-hospital and ICU) using Cox proportional hazards regression 
and restricted cubic splines. The cohort included 419 patients, average age 
56.34 ± 16.62 years, with a majority being male (61.58%). Hospital and ICU 
mortality rates were 11.93% and 7.16%, respectively. Higher TyG-BMI was 
positively correlated with increased all-cause mortality. Patients in the 
highest TyG-BMI quartile had significantly greater risks of in-hospital and ICU 
mortality. An S-shaped curve in the spline analysis indicated a threshold effect 
at a TyG-BMI of 243 for increased in-hospital mortality risk. TyG-BMI is a 
reliable predictor of both in-hospital and ICU mortality in severely ill AP 
patients, suggesting its utility in enhancing risk assessment and guiding 
clinical interventions for this vulnerable population.

© 2024. The Author(s).

DOI: 10.1038/s41598-024-72969-w
PMCID: PMC11405403
PMID: 39285256 [Indexed for MEDLINE]

Conflict of interest statement: The authors declare no competing interests."
