PubMed ID,Details
39164502,"1. Pediatr Nephrol. 2024 Aug 20. doi: 10.1007/s00467-024-06438-x. Online ahead of
 print.

Characteristics and outcomes of children ≤ 10 kg receiving continuous kidney 
replacement therapy: a WE-ROCK study.

Menon S(1)(2), Starr MC(3), Zang H(4), Collins M(4), Damian MA(5), Fuhrman D(6), 
Krallman K(4), Soranno DE(3), Webb TN(7), Slagle C(3), Joseph C(8), Martin 
SD(9), Mohamed T(10), Beebe ME(10), Ricci Z(11), Ollberding N(4), Selewski 
D(12), Gist KM(4); WE-ROCK investigators.

Collaborators: Ahern E, Arikan AA, Alhamoud I, Alobaidi R, Anton-Martin P, 
Balani SS, Barhight M, Basalely A, Bigelow AM, Bottari G, Cappoli A, Ciccia EA, 
Colosimo D, Cortina G, De la Mata Navazo S, DeAbreu G, Deep A, Ding KL, Dolan 
KJ, Lafever SN, Gelbart B, Gorga SM, Guzzi F, Guzzo I, Haga T, Harvey E, Hasson 
DC, Hill-Horowitz T, Inthavong H, Kaddourah A, Kakajiwala A, Kessel AD, Korn S, 
Kwiatkowski DM, Lee J, Lequier L, Kia TM, Mah KE, Marinari E, Morgan C, Mottes 
TA, Muff-Luett MA, Namachivayam S, Neumayr TM, Nhan J, O'Rourke A, Pinto MG, 
Qutob D, Raggi V, Reynaud S, Rumlow ZA, Lozano MJ, See E, Serpe C, Serratore A, 
Shah A, Shih WV, Shin H, Solomon S, Srivastava R, Stanski NL, Stenson EK, Strong 
AE, Taylor SA, Thadani SV, Uber AM, Van Wyk B, Zangla EE, Zappitelli M, Alvarez 
TCE, Bixler E, Brown EB, Brown CL, Burrell A, Dash A, Ehrlich JL, Farma S, 
Gahring K, Gales B, Hilgenkamp MR, Jain S, Kanwar K, Lusk J, Meyer CJ, 
Plomaritas K, Porter J, Potts J, Serratore A, Schneider E, Sinha V, Strack PJ, 
Taylor S, Twombley K, Van Wyk B, Wallace S, Wang J, Woods M, Zinger M, Zong A.

Author information:
(1)Department of Pediatrics, Center for Academic Medicine, Pediatric Nephrology, 
Lucile Packard Children's Hospital, Stanford University, MC-5660, 453 Quarry Rd, 
Palo Alto, CA, 94304, USA. shinam@stanford.edu.
(2)Department of Pediatrics, Seattle Children's Hospital, University of 
Washington School of Medicine, Seattle, WA, USA. shinam@stanford.edu.
(3)Department of Pediatrics, Riley Children's Hospital, Indiana University 
School of Medicine, Indianapolis, IN, USA.
(4)Department of Pediatrics, Cincinnati Children's Hospital Medical Center, 
University of Cincinnati College of Medicine, Cincinnati, OH, USA.
(5)Department of Pediatrics, Center for Academic Medicine, Pediatric Nephrology, 
Lucile Packard Children's Hospital, Stanford University, MC-5660, 453 Quarry Rd, 
Palo Alto, CA, 94304, USA.
(6)Department of Pediatrics, Pittsburgh Children's Hospital, University of 
Pittsburgh Medical Center, Pittsburgh, PA, USA.
(7)Department of Pediatrics, Children's Hospital of Alabama, University of 
Alabama at Birmingham School of Medicine, Birmingham, AL, USA.
(8)Department of Pediatrics, Baylor College of Medicine, Texas Children's 
Hospital, Houston, TX, USA.
(9)Division of Pediatric Critical Care, University of Rochester, Golisano 
Children's Hospital, Rochester, NY, USA.
(10)The Kidney and Urinary Tract Center, Nationwide Children's Hospital, The 
Ohio State University, Columbus, OH, USA.
(11)AOU Meyer Children's Hospital, IRCCS, Florence, University of Florence, 
Florence, Italy.
(12)Medical University of South Carolina, Charleston, SC, USA.

BACKGROUND: Continuous kidney replacement therapy (CKRT) is often used for acute 
kidney injury (AKI) or fluid overload (FO) in children ≤ 10 kg. Intensive care 
unit (ICU) mortality in children ≤ 10 kg reported by the prospective pediatric 
CRRT (ppCRRT, 2001-2003) registry was 57%. We aimed to evaluate characteristics 
associated with ICU mortality using a contemporary registry.
METHODS: The Worldwide Exploration of Renal Replacement Outcomes Collaborative 
in Kidney Disease (WE-ROCK) registry is a retrospective, multinational, 
observational study of children and young adults aged 0-25 years receiving CKRT 
(2015-2021) for AKI or FO. This analysis included patients ≤ 10 kg at hospital 
admission.
PRIMARY AND SECONDARY OUTCOMES: ICU mortality and major adverse kidney events at 
90 days (MAKE-90) defined as death, persistent kidney dysfunction, or dialysis 
within 90 days, respectively.
RESULTS: A total of 210 patients were included (median age 0.53 years (IQR, 0.1, 
0.9)). ICU mortality was 46.5%. MAKE-90 occurred in 150/207 (72%). CKRT was 
initiated at a median 3 days (IQR 1, 9) after ICU admission and lasted a median 
6 days (IQR 3, 16). On multivariable analysis, pediatric logistic organ 
dysfunction score (PELOD-2) at CKRT initiation was associated with increased 
odds of ICU mortality (aOR 2.64, 95% CI 1.68-4.16), and increased odds of 
MAKE-90 (aOR 2.2, 95% CI 1.31-3.69). Absence of comorbidity was associated with 
lower MAKE-90 (aOR 0.29, 95%CI 0.13-0.65).
CONCLUSIONS: We report on a contemporary cohort of children ≤ 10 kg treated with 
CKRT for acute kidney injury and/or fluid overload. ICU mortality is decreased 
compared to ppCRRT. The extended risk of death and morbidity at 90 days 
highlights the importance of close follow-up.

© 2024. The Author(s), under exclusive licence to International Pediatric 
Nephrology Association.

DOI: 10.1007/s00467-024-06438-x
PMID: 39164502"
39163391,"1. PLoS One. 2024 Aug 20;19(8):e0307265. doi: 10.1371/journal.pone.0307265. 
eCollection 2024.

Outcomes of different steroid dosing regimens in critical Covid-19 pneumonia at 
a Kenyan hospital: A retrospective cohort study.

Odhiambo JO(1), Shah J(2), Kunyiha N(1), Makasa C(1), Riunga F(1).

Author information:
(1)Healthcare Practitioner at the Department of Internal Medicine, Aga 
University, Nairobi, Kenya.
(2)Statistician at the Department of Internal Medicine and Brain and Mind 
Institute, Aga Khan University, Nairobi, Kenya.

BACKGROUND: Among therapeutic options for severe and critical COVID- 19 
infection, dexamethasone six milligrams once daily for ten days has demonstrated 
mortality benefit and is guideline recommended at this dose. In practice, 
variable doses of steroids have been used, especially in critical care settings. 
Our study aimed to determine the pattern of steroid dosing and outcomes in terms 
of critical care mortality, occurrence of dysglycaemias, and occurrence of 
superadded infections in patients with critical COVID-19.
METHODS: A retrospective cohort study was carried out on all eligible patients 
admitted to the Aga Khan University Hospital, Nairobi, with critical COVID-19 
between 1st March 2020 and 31st December 2021. The intervention of interest was 
corticosteroids quantified as the average daily dose in milligrams of 
dexamethasone. A steroid dose of six milligrams once a day was compared to high 
dose steroid dosing, which was defined as any dose greater than this. The 
primary outcome measure was ICU mortality and secondary outcomes included 
occurrence of dysglycaemias, superadded infections and duration of critical care 
admission.
RESULTS: The study included 288 patients. The median age was 61.2 years (IQR: 
49.7, 72.5), with 71.2% of patients being male. The most common comorbidities 
were diabetes mellitus (60.7%), hypertension (58%), and heart disease (12.2%). 
The average oxygen saturation and C-reactive protein at admission were 82% [IQR: 
70.0-89.0]and 113.0 [IQR: 54.0-186.0], respectively. Fifty-eight percent of 
patients received a standard dose (6mg) of steroids. The mortality rate was 
higher in the high-dose group compared to the standard-dose group; however, the 
difference was not statistically significant (47.9% vs 43.7% p = 0.549). The two 
most common steroid associated adverse effects were uncomplicated hyperglycemia 
(62.2%) and superimposed bacterial pneumonia (20.1%). The high-dose group had a 
higher incidence of uncomplicated hyperglycemia compared to the standard-dose 
group (63.6% vs 61.1%). However, the incidence of diabetic ketoacidosis was 
lower in the high dose group (0.6% vs 6.6%). Oxygen saturation at admission was 
associated with survival where it was lower among non-survivor patients with 
critical COVID-19.
CONCLUSION: The study found that high-dose steroids in the treatment of 
critically ill patients with COVID-19 pneumonia did not confer any mortality 
benefit and were associated with an increased risk of dysglycemia and 
superimposed infections.

Copyright: © 2024 Odhiambo et al. This is an open access article distributed 
under the terms of the Creative Commons Attribution License, which permits 
unrestricted use, distribution, and reproduction in any medium, provided the 
original author and source are credited.

DOI: 10.1371/journal.pone.0307265
PMCID: PMC11335146
PMID: 39163391 [Indexed for MEDLINE]

Conflict of interest statement: The authors have declared that no competing 
interests exist."
39157528,"1. Front Public Health. 2024 Aug 2;12:1373585. doi: 10.3389/fpubh.2024.1373585. 
eCollection 2024.

The clinical value of inflammation index in predicting ICU mortality of 
critically ill patients with intracerebral hemorrhage.

Zhao G(#)(1), Gu Y(#)(1), Wang Z(2), Chen Y(1), Xia X(1).

Author information:
(1)Department of Emergency Medicine, The First People's Hospital of Kunshan, 
Kunshan, China.
(2)Department of Endocrinology, The First People's Hospital of Kunshan, Kunshan, 
China.
(#)Contributed equally

BACKGROUND: The inflammatory response holds paramount significance in the 
context of intracerebral hemorrhage (ICH) and exhibits a robust correlation with 
mortality rates. Biological markers such as the neutrophil-to-lymphocyte ratio 
(NLR), platelet-to-lymphocyte ratio (PLR), lymphocyte-to-monocyte ratio (LMR), 
systemic immune inflammation index (SII), and systemic inflammatory response 
index (SIRI) play crucial roles in influencing the systemic inflammatory 
response following ICH. This study aims to compare the predictive efficacy of 
NLR, PLR, LMR, SII, and SIRI concerning the risk of mortality in the intensive 
care unit (ICU) among critically ill patients with ICH. Such a comparison seeks 
to elucidate their early warning capabilities in the management and treatment of 
ICH.
METHODS: Patients with severe ICH requiring admission to the ICU were screened 
from the Medical Information Marketplace for Intensive Care (MIMIC-IV) database. 
The outcomes studied included ICU mortality and 30 day ICU hospitalization 
rates, based on tertiles of the NLR index level. To explore the relationship 
between the NLR index and clinical outcomes in critically ill patients with ICH, 
we utilized receiver operating characteristic (ROC) analysis, decision curve 
analysis (DCA), and multivariate logistic regression analysis.
RESULTS: A total of 869 patients (51.9% male) were included in the study, with 
an ICU mortality rate of 22.9% and a 30 day ICU hospitalization rate of 98.4%. 
Among the five indicators examined, both the ROC curve and DCA indicated that 
NLR (AUC: 0.660, 95%CI: 0.617-0.703) had the highest predictive ability for ICU 
mortality. Moreover, this association remained significant even after adjusting 
for other confounding factors during multivariate analysis (HR: 3.520, 95%CI: 
2.039-6.077). Based on the results of the multivariate analysis, incorporating 
age, albumin, lactic acid, NLR, and GCS score as variables, we developed a 
nomogram to predict ICU mortality in critically ill patients with ICH.
CONCLUSION: NLR emerges as the most effective predictor of ICU mortality risk 
among critically ill patients grappling with ICH when compared to the other four 
indicators. Furthermore, the integration of albumin and lactic acid indicators 
into the NLR nomogram enhances the ability to promptly identify ICU mortality in 
individuals facing severe ICH.

Copyright © 2024 Zhao, Gu, Wang, Chen and Xia.

DOI: 10.3389/fpubh.2024.1373585
PMCID: PMC11327062
PMID: 39157528 [Indexed for MEDLINE]

Conflict of interest statement: The authors declare that the research was 
conducted in the absence of any commercial or financial relationships that could 
be construed as a potential conflict of interest."
39151513,"1. Medicine (Baltimore). 2024 Aug 16;103(33):e39262. doi: 
10.1097/MD.0000000000039262.

Association between the triglyceride-glucose index and mortality in critically 
ill patients: A meta-analysis.

Nie M(1), Jiang B, Xu Y.

Author information:
(1)Department of Critical Care Medicine, West China Hospital/West China School 
of Nursing, Sichuan University, Chengdu, China.

BACKGROUND: To further identify the association of the triglyceride-glucose 
(TyG) index with the risk of mortality among critically ill patients admitted to 
the intensive care unit (ICU).
METHODS: The PubMed, Web of Science, and EMBASE databases were searched for 
relevant studies up to February 2, 2024. The primary outcomes were in-hospital 
mortality and ICU mortality. The secondary outcomes were 30-day mortality, 
90-day mortality, and 1-year mortality. The hazard ratios (HRs) with 95% 
confidence intervals (CIs) were combined to evaluate the associations between 
the TyG index and the above endpoints. All the statistical analyses were 
performed with STATA 15.0 software.
RESULTS: Ten studies involving 22,694 patients were included. The pooled results 
demonstrated that an elevated TyG index indicated an increased risk of 
in-hospital mortality (HR = 1.76, 95% CI: 1.41-2.18, P < .001), ICU mortality 
(HR = 1.52, 95% CI: 1.33-1.74, P < .001), 30-day mortality (HR = 1.50, 95% CI: 
1.02-2.19, P = .037), 90-day mortality (HR = 1.42, 95% CI: 1.01-2.00, P = .043), 
and 1-year mortality (HR = 1.19, 95% CI: 1.11-1.28, P < .001). Subgroup analysis 
for in-hospital mortality and ICU mortality based on sex, age, body mass index 
and hypertension showed similar results. However, subgroup analysis stratified 
by diabetes mellitus (DM) revealed that the associations of the TyG index with 
in-hospital mortality (HR = 2.21, 95% CI: 1.30-3.78, P = .004) and ICU mortality 
(HR = 1.93, 95% CI: 0.95-3.94, P = .070) were observed only among patients 
without DM.
CONCLUSION: The TyG index was significantly associated with mortality among 
critically ill patients without DM, and an elevated TyG index predicted an 
increased risk of mortality.

Copyright © 2024 the Author(s). Published by Wolters Kluwer Health, Inc.

DOI: 10.1097/MD.0000000000039262
PMCID: PMC11332756
PMID: 39151513 [Indexed for MEDLINE]

Conflict of interest statement: The authors have no conflicts of interest to 
disclose."
39139353,"1. Cureus. 2024 Jul 13;16(7):e64481. doi: 10.7759/cureus.64481. eCollection 2024 
Jul.

Comparison Between Early and Late Tracheostomy in ICU Patients Including 
COVID-19 and Non-COVID-19 Patients: A Retrospective Cohort Study at a Tertiary 
Care Hospital.

Al Balushi Y(1), Burad J(1).

Author information:
(1)Anesthesia and Intensive Care, Sultan Qaboos University Hospital, Muscat, 
OMN.

Background Tracheostomy is a common intervention for intensive care unit (ICU) 
patients for various reasons. The superiority of early versus late tracheostomy 
is still unfounded for non-COVID-19 cases. The COVID-19 pandemic complicated the 
matter, as little literature was available on the ideal timing of tracheostomy 
for patients with COVID-19. Research question This study aimed to establish the 
superiority of early or late tracheostomy for COVID-19 and non-COVID-19 cases by 
comparing outcomes, including ICU mortality, ventilation days after 
tracheostomy, and ICU length of stay (LOS). Study design and methods A 
single-center retrospective cohort study was conducted on ventilated ICU 
patients both with and without COVID-19 at a university hospital between January 
2020 and December 2021. During the study period, 1,393 ventilated patients were 
scanned, and 156 were found to be tracheostomized. Tracheostomy was considered 
to be early when performed within 10 days of intubation, after which it was 
considered to be late. Results Tracheostomy was performed early for 84/156 
(53.8%) of tracheostomized patients and late for 72/156 (46.2%) of patients. The 
overall mortality was 42.9% (36/84) versus 69.4% (50/72) (P=0.001, OR=3.03, 95% 
CI=1.563-5.874), 31.4% versus 65.5% in the non-COVID-19 group and 60.6% versus 
72.1% (P=0.005, OR=2.640, 95% CI=1.345-5.181) in the COVID-19 group for the 
early and late tracheostomy groups, respectively. Ventilation days were higher 
for the late tracheostomy group than for the early tracheostomy group in the 
non-COVID-19 group (17.10 versus 9.18 days, P<0.001). However, it was almost the 
same for the early and late tracheostomy groups in the COVID-19 group (14.15 
versus 13.86 days, P=0.821). The ICU LOS was greater for the late tracheostomy 
group for both the COVID-19 and non-COVID-19 groups. Multivariate analysis 
revealed that ICU mortality is significantly associated with age, ventilation 
days, and ICU LOS. Interpretation The results of this study indicate that early 
tracheostomy was associated with lower mortality, fewer ventilation days, and 
shorter LOS in both the COVID-19 and non-COVID-19 groups.

Copyright © 2024, Al Balushi et al.

DOI: 10.7759/cureus.64481
PMCID: PMC11319799
PMID: 39139353

Conflict of interest statement: Human subjects: Consent was obtained or waived 
by all participants in this study. Medical Research Ethics Committee of Sultan 
Qaboos University Hospital issued approval MREC #2688. Animal subjects: All 
authors have confirmed that this study did not involve animal subjects or 
tissue. Conflicts of interest: In compliance with the ICMJE uniform disclosure 
form, all authors declare the following: Payment/services info: All authors have 
declared that no financial support was received from any organization for the 
submitted work. Financial relationships: All authors have declared that they 
have no financial relationships at present or within the previous three years 
with any organizations that might have an interest in the submitted work. Other 
relationships: All authors have declared that there are no other relationships 
or activities that could appear to have influenced the submitted work."
39130418,"1. Heliyon. 2024 Jul 14;10(14):e34644. doi: 10.1016/j.heliyon.2024.e34644. 
eCollection 2024 Jul 30.

Relationship between coagulopathy score and ICU mortality: Analysis of the 
MIMIC-IV database.

Xie Z(1), Zhu S(2), Wang J(1), Zhang M(3), Lv X(1), Ma Y(1), Shan H(1), Zhong 
Y(2).

Author information:
(1)Master of Medicine, The First People's Hospital of Linping District, 
Department of Neurosurgery, China.
(2)Bachelor of Medicine, The First People's Hospital of Linping District, 
Department of Neurosurgery, China.
(3)Bachelor of Nursing, The First People's Hospital of Linping District, 
Department of Neurosurgery, China.

OBJECTIVE: Coagulopathy score has been applied as a new prognostic indicator for 
sepsis, heart failure and acute respiratory failure. However, its ability to 
forecast intensive care unit (ICU) mortality in patients with an acute cerebral 
hemorrhage (ICH) has not been assessed. The purpose of this study was to clarify 
the relationship between ICU mortality and early coagulation problem score.
METHODS: Data from the Medical Information Mart for Intensive Care (MIMIC-IV) 
(v2.0) database were used in this retrospective cohort analysis. The association 
between the coagulation disorder score and ICU mortality was examined using 
multivariate logistic regression. Furthermore, the impact of additional 
variables on the results was investigated by a subgroup analysis.
RESULTS: 3174 patients (57.3 % male) were enrolled in total. The ICU mortality 
reached 18.2 %. After adjusting for potential confounders, the ICU mortality of 
patients rose with the increase of coagulation disorder score. The ROC curve 
revealed the predictive accuracy of coagulation dysfunction score to mortality 
in patients with ICU. The coagulation disorder score had a lower AUC value 
(0.601, P < 0.001) than the SAPSII(AUCs of 0.745[95 % CI, 0.730-0.761]) and the 
combined indicators(AUCs of 0.752[95 % CI, 0.737-0.767]), but larger than single 
indicators platelet, INR and APTT. In the subgroup analysis, most subgroups 
showed no significant interaction, but only age showed significant interaction 
in the adjusted model.
CONCLUSION: The coagulopathy score and ICU mortality were found to be strongly 
positively correlated in this study, and its ability to predict ICU mortality 
was better than that of a single measure (platelet, INR, or APTT), but worse 
than that of the SAPSII score, GCS system.

© 2024 The Authors.

DOI: 10.1016/j.heliyon.2024.e34644
PMCID: PMC11315200
PMID: 39130418

Conflict of interest statement: The authors declare that they have no known 
competing financial interests or personal relationships that could have appeared 
to influence the work reported in this paper."
39120451,"1. Crit Care Med. 2024 Nov 1;52(11):e545-e556. doi: 10.1097/CCM.0000000000006393.
 Epub 2024 Aug 9.

ICU-Electroencephalogram Unit Improves Outcome in Status Epilepticus Patients: A 
Retrospective Before-After Study.

Misirocchi F(1)(2), Quintard H(2)(3), Kleinschmidt A(3)(4), Schaller K(3)(5), 
Pugin J(2)(3), Seeck M(3)(4), De Stefano P(2)(4).

Author information:
(1)Unit of Neurology, Department of Medicine and Surgery, University of Parma, 
Parma, Italy.
(2)Division of Intensive Care, Department or Anaesthesiology, Pharmacology, 
Intensive Care and Emergency Medicine Geneva University Hospitals, Faculty of 
Medicine, University of Geneva, Geneva, Switzerland.
(3)Medical Faculty of the University of Geneva, Geneva, Switzerland.
(4)EEG & Epilepsy Unit, Department of Clinical Neurosciences, University 
Hospital of Geneva, Geneva, Switzerland.
(5)Department of Neurosurgery, Geneva University Medical Center & Faculty of 
Medicine, University of Geneva, Geneva, Switzerland.

OBJECTIVES: Continuous electroencephalogram (cEEG) monitoring is recommended for 
status epilepticus (SE) management in ICU but is still underused due to resource 
limitations and inconclusive evidence regarding its impact on outcome. 
Furthermore, the term ""continuous monitoring"" often implies continuous recording 
with variable intermittent review. The establishment of a dedicated 
ICU-electroencephalogram unit may fill this gap, allowing cEEG with nearly 
real-time review and multidisciplinary management collaboration. This study 
aimed to evaluate the effect of ICU-electroencephalogram unit establishing on SE 
outcome and management.
DESIGN: Single-center retrospective before-after study.
SETTING: Neuro-ICU of a Swiss academic tertiary medical care center.
PATIENTS: Adult patients treated for nonhypoxic SE between November 1, 2015, and 
December 31, 2023.
INTERVENTIONS: None.
MEASUREMENT AND MAIN RESULTS: Data from all SE patients were assessed, comparing 
those treated before and after ICU-electroencephalogram unit introduction. 
Primary outcomes were return to premorbid neurologic function, ICU mortality, SE 
duration, and ICU SE management. Secondary outcomes were SE type and etiology. 
Two hundred seven SE patients were included, 149 (72%) before and 58 (38%) after 
ICU-electroencephalogram unit establishment. ICU-electroencephalogram unit 
introduction was associated with increased detection of nonconvulsive SE ( p = 
0.003) and SE due to acute symptomatic etiology ( p = 0.019). Regression 
analysis considering age, comorbidities, SE etiology, and SE semeiology revealed 
a higher chance of returning to premorbid neurologic function ( p = 0.002), 
reduced SE duration ( p = 0.024), and a shift in SE management with increased 
use of antiseizure medications ( p = 0.007) after ICU-electroencephalogram unit 
introduction.
CONCLUSIONS: Integrating neurology expertise in the ICU setting through the 
establishment of an ICU-electroencephalogram unit with nearly real-time cEEG 
review, shortened SE duration, and increased likelihood of returning to 
premorbid neurologic function, with an increased number of antiseizure 
medications used. Further studies are warranted to validate these findings and 
assess long-term prognosis.

Copyright © 2024 The Author(s). Published by Wolters Kluwer Health, Inc. on 
behalf of the Society of Critical Care Medicine and Wolters Kluwer Health, Inc.

DOI: 10.1097/CCM.0000000000006393
PMCID: PMC11469622
PMID: 39120451 [Indexed for MEDLINE]

Conflict of interest statement: Dr. Misirocchi is supported by the 2023 
International Federation of Clinical Neurophysiology Research Fellowship Grant. 
Dr. Kleinschmidt has received honoraria for consulting from Abbvie, Eli Lilly, 
Lundbeck, Mitsubishi Tanabe, Novartis, and TEVA that were paid to a teaching and 
research fund at the University Hospital Geneva. Dr. Seeck is a shareholder of 
Epilog NV (Ghent, Belgium); she received grants from the Swiss National Science 
Foundation (163398, CRS115-180365). Dr. De Stefano was supported by the Swiss 
National Science Foundation (163398, CRS115-180365) and is supported by the 2022 
Swiss League Against Epilepsy Research Support Prize; she is supported by the 
Swiss National Science Foundation (163398, CRS115-180365) and is supported by 
the 2022 Swiss League Against Epilepsy Research Support Prize. The remaining 
authors have disclosed that they do not have any potential conflicts of 
interest."
