PubMed ID,Details
39251097,"1. Respir Med. 2024 Sep 7;234:107803. doi: 10.1016/j.rmed.2024.107803. Online
ahead  of print.

A nomogram for predicting short-term mortality in ICU patients with coexisting 
chronic obstructive pulmonary disease and congestive heart failure.

Shi Q(1), Xu J(2), Zeng L(3), Lu Z(4), Chen Y(5).

Author information:
(1)Department of Respiratory Medicine, Affiliated Dongyang Hospital of Wenzhou 
Medical University, Dongyang, China. Electronic address: 414293061@qq.com.
(2)Department of Respiratory Medicine, Changxing People's Hospital, Huzhou, 
China. Electronic address: 2426805752@qq.com.
(3)Department of High Dependency Unit (Respiratory Support), Hangzhou Geriatric 
Hospital, Hangzhou, China. Electronic address: zenglonghuan@163.com.
(4)Department of Cardiology, Affiliated Dongyang Hospital of Wenzhou Medical 
University, Dongyang, China. Electronic address: 754672968@qq.com.
(5)Department of High Dependency Unit (Respiratory Support), Hangzhou Geriatric 
Hospital, Hangzhou, China. Electronic address: 2435534553@qq.com.

OBJECTIVE: This study aimed to develop and validate a nomogram for predicting 
28-day and 90-day mortality in intensive care unit (ICU) patients who have 
chronic obstructive pulmonary disease (COPD) coexisting with congestive heart 
failure (CHF).
METHODS: An extensive analysis was conducted on clinical data from the Medical 
Information Mart for Intensive Care IV database, covering patients over 18 years 
old with both COPD and CHF, who were were first-time ICU admissions between 2008 
and 2019. The least absolute shrinkage and selection operator (LASSO) regression 
method was employed to screen clinical features, with the final model being 
optimized using backward stepwise regression guided by the Akaike Information 
Criterion (AIC) to construct the nomogram. The predictive model's discrimination 
and clinical applicability were evaluated via receiver operating characteristic 
(ROC) curves, calibration curves, the C-index, and decision curve analysi s 
(DCA).
RESULTS: This analysis was comprised of a total of 1948 patients. Patients were 
separated into developing and validation cohorts in a 7:3 ratio, with similar 
baseline characteristics between the two groups. The ICU mortality rates for the 
developing and verification cohorts were 20.8 % and 19.5 % at 28 days, 
respectively, and 29.4 % and 28.3 % at 90 days, respectively. The clinical 
characteristics retained by the backward stepwise regression include age, 
weight, systolic blood pressure (SBP), respiratory rate (RR), oxygen saturation 
(SpO2), red blood cell distribution width (RDW), lactate, partial thrombosis 
time (PTT), race, marital status, type 2 diabetes mellitus (T2DM), malignant 
cancer, acute kidney failure (AKF), pneumonia, immunosuppressive drugs, 
antiplatelet agents, vasoactive agents, acute physiology score III (APS III), 
Oxford acute severity of illness score (OASIS), and Charlson comorbidity index 
(CCI). We developed two separate models by assigning weighted scores to each 
independent risk factor: nomogram A excludes CCI but includes age, T2DM, and 
malignant cancer, while nomogram B includes only CCI, without age, T2DM, and 
malignant cancer. Based on the results of the AUC and C-index, this study 
selected nomogram A, which demonstrated better predictive performance, for 
subsequent validation. The calibration curve, C-index, and DCA results indicate 
that nomogram A has good accuracy in predicting short-term mortality and 
demonstrates better discriminative ability than commonly used clinical scoring 
systems, making it more suitable for clinical application.
CONCLUSION: The nomogram developed in this study offers an effective assessment 
of short-term mortality risk for ICU patients with COPD and CHF, proving to be a 
superior tool for predicting their short-term prognosis.

Copyright © 2024 Elsevier Ltd. All rights reserved.

DOI: 10.1016/j.rmed.2024.107803
PMID: 39251097

Conflict of interest statement: Declaration of competing interest The authors 
declare that they have no known competing financial interests or personal 
relationships that could have appeared to influence the work reported in this 
paper."
39238710,"1. Cureus. 2024 Aug 6;16(8):e66268. doi: 10.7759/cureus.66268. eCollection 2024 
Aug.

Comparison of Four Severity Assessment Scoring Systems in Critically Ill 
Patients for Predicting Patient Outcomes: A Prospective Observational Study From 
a Single Tertiary Center in Central India.

Mishra S(1), Swain AK(1), Tharwani S(1), Kumar D(1), Meshram S(2), Shukla A(3).

Author information:
(1)Anaesthesiology and Critical Care Medicine, Balco Medical Centre, Raipur, 
IND.
(2)Oncoanesthesiology, Balco Medical Centre, Raipur, IND.
(3)Critical Care Medicine, Amar Jain Hospital, Jaipur, IND.

Background and aim A variety of scoring systems are employed in intensive care 
units (ICUs) with the objective of predicting patient morbidity and mortality. 
The present study aimed to compare four different severity assessment scoring 
systems, namely, Acute Physiology and Chronic Health Evaluation II (APACHE II), 
Rapid Emergency Medicine Score (REMS), Sequential Organ Failure Assessment 
(SOFA), and Simplified Acute Physiologic Score II (SAPS II) to predict prognosis 
of all patients admitted to a mixed medical ICU of a tertiary care teaching 
hospital in central India. Methods The prospective observational study included 
1136 patients aged 18 years or more, admitted to the mixed medical ICU. All 
patients underwent severity assessment using the four scoring systems, namely 
APACHE II, SOFA, REMS, and SAPS II, after admission. Predicted mortality was 
calculated from each of the scores and actual patient outcomes were noted. 
Receiver operating curve analysis was undertaken to identify the cut-off value 
of individual scoring systems for predicting mortality with optimum sensitivity 
and specificity. Calibration and discrimination were employed to ascertain the 
validity of each scoring model. Bivariate and multivariable logistic regression 
analyses among the study participants were conducted to identify the best 
scoring system, after adjusting for potential confounders. Results Final 
analysis was done on 957 study participants (mean (±SD) age-58.4 (±12.9) years; 
males-62.2%). The mortality rate was 14.7%. APACHE II, SOFA, SAPS II, and REMS 
scores were significantly higher among the non-survivors as compared to the 
survivors (p<0.05). SAPS II was found to have the highest AUC of 0.981 
(p<0.001). SAPS II score >58 had 93.6% sensitivity, 94.1% specificity, 73.3% 
PPV, 98.8% NPV, and 94.0% diagnostic accuracy in predicting mortality. This 
scoring system also had the best calibration. Binary logistic regression showed 
that all four scoring systems were significantly associated with ICU mortality. 
After adjusting for each other, only SAPS II remained significantly associated 
with ICU mortality. Conclusion Both SAPS II and APACHE II were observed to have 
good calibration and discriminatory power; however, SAPS II had the best 
prediction power suggesting that it may be a useful tool for clinicians and 
researchers in assessing the severity of illness and mortality risk in 
critically ill patients.

Copyright © 2024, Mishra et al.

DOI: 10.7759/cureus.66268
PMCID: PMC11375909
PMID: 39238710

Conflict of interest statement: Human subjects: Consent was obtained or waived 
by all participants in this study. AIIMS, Raipur issued approval 
1631/IEC-AIIMSRPR/2021. Animal subjects: All authors have confirmed that this 
study did not involve animal subjects or tissue. Conflicts of interest: In 
compliance with the ICMJE uniform disclosure form, all authors declare the 
following: Payment/services info: All authors have declared that no financial 
support was received from any organization for the submitted work. Financial 
relationships: All authors have declared that they have no financial 
relationships at present or within the previous three years with any 
organizations that might have an interest in the submitted work. Other 
relationships: All authors have declared that there are no other relationships 
or activities that could appear to have influenced the submitted work."
39232765,"1. Lipids Health Dis. 2024 Sep 4;23(1):283. doi: 10.1186/s12944-024-02264-0.

Heart-type fatty acid binding protein (H-FABP) as an early biomarker in 
sepsis-induced cardiomyopathy: a prospective observational study.

Chang X(1), Guo Y(1), Wang J(1), Liu J(1), Ma Y(1), Lu Q(2), Han Y(3)(4).

Author information:
(1)Nanjing Medical University, 101 Longmian Avenue, Nanjing, China.
(2)China Pharmaceutical University, 639 Longmian Avenue, Nanjing, China.
(3)Nanjing Medical University, 101 Longmian Avenue, Nanjing, China. 
yihan@hrbmu.edu.cn.
(4)Department of Critical Care Medicine, The Second Affiliated Hospital of 
Harbin Medical University, Harbin, China. yihan@hrbmu.edu.cn.

BACKGROUND: Sepsis-induced cardiomyopathy (SICM) is a common and 
life-threatening complication of sepsis, significantly contributing to elevated 
mortality. This study aimed to identify crucial indicators for the prompt and 
early assessment of SICM.
METHODS: Patients diagnosed with sepsis or SICM within 24 h of intensive care 
unit (ICU) admission were enrolled in this prospective observational study. 
Patients were assigned to the training set, validation set and external test 
set. The primary endpoint was 7-day ICU mortality, and the secondary endpoint 
was 28-day ICU mortality. Three machine learning algorithms were utilized to 
identify relevant indicators for diagnosing SICM, incorporating 64 indicators 
including serum biomarkers associated with cardiac, renal, and liver function, 
lipid metabolism, coagulation, and inflammation. Internal and external 
validations were performed on the screening results. Patients were then 
stratified based on the cut-off value of the most diagnostically effective 
biomarker identified, and their prognostic outcomes were observed and analyzed.
RESULTS: A total of 270 patients were included in the training and validation 
set, and 52 patients were included in the external test set. Age, sex, and 
comorbidities did not significantly differ between the sepsis and SICM groups 
(P > 0.05). The support vector machine (SVM) algorithm identified six indicators 
with an accuracy of 84.5%, the random forest (RF) algorithm identified six 
indicators with an accuracy of 81.9%, and the logistic regression (LR) algorithm 
screened out seven indicators. Following rigorous selection, a diagnostic model 
for sepsis-induced cardiomyopathy was established based on heart-type fatty acid 
binding protein (H-FABP) (OR 1.308, 95% CI 1.170-1.462, P < 0.001) and 
retinol-binding protein (RBP) (OR 1.020, 95% CI 1.006-1.034, P < 0.05). H-FABP 
alone exhibited the highest diagnostic performance in both the internal (AUROC 
0.689, P < 0.05) and external sets (AUROC 0.845, P < 0.05). Patients with SICM 
were further stratified based on an H-FABP diagnostic cut-off value of 
8.335 ng/mL. Kaplan-Meier curve analysis demonstrated that elevated H-FABP 
levels at admission were associated with higher 7-day ICU mortality in patients 
with SICM (P < 0.05).
CONCLUSIONS: This study revealed that H-FABP concentrations measured within 24 h 
of patient admission could serve as a crucial biomarker for the early and rapid 
diagnosis and short-term prognostic evaluation of SICM.

© 2024. The Author(s).

DOI: 10.1186/s12944-024-02264-0
PMCID: PMC11373395
PMID: 39232765 [Indexed for MEDLINE]

Conflict of interest statement: The authors declare no competing interests."
39224423,"1. J Intensive Care Soc. 2024 Mar 18;25(3):279-287. doi:
10.1177/17511437241238877.  eCollection 2024 Aug.

Outcomes of percutaneous versus surgical tracheostomy in an Australian 
Quaternary Intensive Care Unit: An entropy-balanced retrospective study.

Devanand NA(1), Thiruvenkatarajan V(2)(3), Liu WM(4), Sirisinghe I(5), 
Court-Kowalski S(1), Pryor L(6)(7), Gatley A(6), Sethi S(8), Sundararajan 
K(9)(10).

Author information:
(1)Intensive Care Unit, Royal Adelaide Hospital, Adelaide, SA, Australia.
(2)Department of Anaesthesia, The Queen Elizabeth Hospital, SA, Australia.
(3)Discipline of Acute Care Medicine, The University of Adelaide, Adelaide, SA, 
Australia.
(4)Research School of Finance, Actuarial Studies, and Statistics, Australian 
National University, Canberra, ACT, Australia.
(5)St John of God Midland Hospital, Midland, WA, Australia.
(6)Intensive Care Unit, Department of Speech Pathology, Royal Adelaide Hospital, 
Adelaide, SA, Australia.
(7)School of Allied Health Science and Practice, The University of Adelaide, 
Adelaide, SA, Australia.
(8)Intensive Care Unit, Royal Perth Hospital, Perth, WA, Australia.
(9)Head of Intensive Care Unit, Critical Care and Perioperative Services 
Programme, Royal Adelaide Hospital, Adelaide, SA, Australia.
(10)School of Medicine, The University of Adelaide, Adelaide, SA, Australia.

BACKGROUND: Studies comparing percutaneous tracheostomy (PT) and surgical 
tracheostomy (ST) complications in the critically ill patient population with 
high acuity, complexity, and severity of illness are sparse. This study 
evaluated the outcomes of elective PT versus ST in such patients managed at a 
quaternary referral center.
AIMS: The primary aim was to detect a difference in hospital mortality between 
the two techniques. The secondary aims were to compare Intensive Care Unit (ICU) 
mortality, complications (including stoma site, tracheostomy-related, and 
decannulation complications), ICU and hospital length of stay, and time to 
decannulation.
METHODS: This was a single-center retrospective observational study of ICU 
admission from August 2018 to August 2021. Patients were included if an elective 
tracheostomy was performed during their ICU admission. Patients with a 
pre-existing tracheostomy and those who underwent an obligatory tracheostomy 
requirement (e.g. total laryngectomy) were excluded. Cohorts were matched using 
Hainmueller's entropy balancing. Binary data were evaluated using logistic 
regression and continuous data with ordinary least squares regression.
RESULTS: 349 patients with a tracheostomy were managed in the ICU during the 
observation period. They were predominantly males (75% in PT; 67% in ST), with a 
mean age in the PT and ST group of (47; SD = 18) and (55; SD = 16), 
respectively. After exclusion, 135 patients remained, with 63 in the PT group 
and 72 in the ST group. Patients receiving ST were significantly older with a 
higher Body Mass Index (BMI) than the PT group. There were no significant 
differences in gender, Acute Physiological And Chronic Health Evaluation 
(APACHE) III, and the Australian and New Zealand Risk Of Death (ANZROD) between 
the two groups. There was no difference in hospital mortality between groups (OR 
0.91, CI 0.26-3.18, p = 0.88). There were also no differences in ICU mortality, 
ICU and hospital length of stay, and time to decannulation. PT was associated 
with a greater likelihood of complications (OR 4.19; 95% CI 1.73-10.13; 
p < 0.01). PT was associated with a greater risk of complications in those who 
had this performed early (<10 days of intubation) as well as late (>10 days of 
intubation).
CONCLUSIONS: Percutaneous tracheostomy was associated with higher complications 
compared to surgical tracheostomy. They were related to tracheostomy cuff 
deflation, stomal site bleeding and infection, sputum plugging, and accidental 
and failed decannulation. These findings have identified opportunities to 
improve patient outcomes.

© The Intensive Care Society 2024.

DOI: 10.1177/17511437241238877
PMCID: PMC11366180
PMID: 39224423

Conflict of interest statement: The author(s) declared no potential conflicts of 
interest with respect to the research, authorship, and/or publication of this 
article."
39224081,"1. Turk J Pharm Sci. 2024 Sep 2;21(4):297-302. doi: 
10.4274/tjps.galenos.2023.92645.

A High-Dose Corticosteroid Treatment Increases Coronavirus Disease of 2019 
Mortality in Intensive Care Units.

Demir İ(1), Yılmaz İ(2), Yılmaz H(2), Özkarataş H(3), Çalık Ş(4).

Author information:
(1)University of Health Sciences Türkiye, Bozyaka Training and Research 
Hospital, Clinic of Internal Medicine, İzmir, Türkiye.
(2)İzmir Kâtip Çelebi University Faculty of Medicine, Department of Pharmacology 
and Toxicology, İzmir, Türkiye.
(3)University of Health Sciences Türkiye, Bozyaka Training and Research 
Hospital, Department of Anesthesiology, İzmir, Türkiye.
(4)University of Health Sciences Türkiye, Bozyaka Training and Research 
Hospital, Clinic of Infectious Diseases and Clinical Microbiology, İzmir, 
Türkiye.

OBJECTIVES: The study is aimed to investigate the association between different 
corticosteroid treatment regimens and clinical status, complications, mechanical 
ventilation requirement, and intensive care unit (ICU) mortality in individuals 
diagnosed with Coronavirus Disease of 2019 (COVID-19).
MATERIALS AND METHODS: This is a descriptive retrospective study. Patients 
admitted to the ICU for COVID-19 and treated with low- or medium-dose 
corticosteroid therapy (methylprednisolone at a dose of 0.5-1 mg/kg for 7-10 
days) were compared with patients treated with high-dose pulse corticosteroid 
therapy (methylprednisolone at varying doses of 250 mg, 500 mg or 1000 mg for 
3-7 days) in addition to standard therapy because of increased pulmonary 
infiltrate and elevated inflammatory markers during clinical monitoring. All 
demographic and clinical data, including age, sex, clinical course, laboratory 
findings, discharge status, 28-day mortality, intubation status, acute 
physiological assessment and chronic health evaluation II score, Charlson 
Comorbidity Index, and sequential organ failure assessment score, were recorded.
RESULTS: Corticosteroid treatment was administered to 689 (88.3%) of 780 
COVID-19 ICU patients between April 2020 and October 2021. The overall mortality 
rate was 45.1% (n= 352). When the mortality rates of patients were compared 
according to the corticosteroid dose, the mortality rate in the 
low-to-medium-dose group (40%) was significantly lower than that in the 
high-dose group (76%). In addition, significant deterioration in laboratory and 
clinical parameters was observed in the high-dose corticosteroid group.
CONCLUSION: High mortality, adverse effects, and complications were 
significantly increased when high-dose corticosteroids were administered. 
Corticosteroid therapy should be used cautiously according to the patient's 
clinical condition, disease stage, comorbidities, and systemic or organ 
reserves.

Copyright© 2024 The Author. Published by Galenos Publishing House on behalf of 
Turkish Pharmacists’ Association.

DOI: 10.4274/tjps.galenos.2023.92645
PMID: 39224081

Conflict of interest statement: Conflict of Interest: No conflict of interest 
was declared by the authors."
39192302,"1. Crit Care. 2024 Aug 27;28(1):278. doi: 10.1186/s13054-024-05074-z.

Role of age as eligibility criterion for ECMO in patients with ARDS: 
meta-regression analysis.

Tonetti T(1)(2), Di Staso R(3), Bambini L(3), Bordini M(3), D'Albo R(3), Nocera 
D(3), Zernini IS(3), Turriziani I(4), Mascia L(5), Rucci P(6), Ranieri VM(7).

Author information:
(1)Department of Medical and Surgical Sciences (DIMEC), Alma Mater Studiorum - 
University of Bologna, Via Massarenti, 9, 40138, Bologna, Italy. 
tommaso.tonetti@unibo.it.
(2)Anesthesiology and General Intensive Care Unit, IRCCS Azienda 
Ospedaliero-Universitaria di Bologna, Bologna, Italy. tommaso.tonetti@unibo.it.
(3)Department of Medical and Surgical Sciences (DIMEC), Alma Mater Studiorum - 
University of Bologna, Via Massarenti, 9, 40138, Bologna, Italy.
(4)Cardio-Thoracic and Vascular Anesthesia and Intensive Care Unit, IRCCS 
Azienda Ospedaliero-Universitaria di Bologna, Bologna, Italy.
(5)Dipartimento di Medicina Sperimentale, Campus Ecotekne University of Salento, 
Lecce, Italy.
(6)Department of Biomedical and Neuromotor Sciences (DIBINEM), Alma Mater 
Studiorum - University of Bologna, Bologna, Italy.
(7)Department of Anesthesia and Intensive Care Medicine, Università degli studi 
di Bari ""Aldo Moro"", Ospedale Policlinico, Bari, Italy.

BACKGROUND: Age as an eligibility criterion for V-V ECMO is widely debated and 
varies among healthcare institutions. We examined how age relates to mortality 
in patients undergoing V-V ECMO for ARDS.
METHODS: Systematic review and meta-regression of clinical studies published 
between 2015 and June 2024. Studies involving at least 6 ARDS patients treated 
with V-V ECMO, with specific data on ICU and/or hospital mortality and patient 
age were included. The search strategy was executed in PubMed, limited to 
English-language. COVID-19 and non-COVID-19 populations were analyzed 
separately. Meta-regressions of mortality outcomes on age were performed using 
gender, BMI, SAPS II, APACHE II, Charlson comorbidity index or SOFA as 
covariates.
RESULTS: In non-COVID ARDS, the meta-regression of 173 studies with 56,257 
participants showed a significant positive association between mean age and 
ICU/hospital mortality. In COVID-19 ARDS, a significant relationship between 
mean age and ICU mortality, but not hospital mortality, was found in 103 studies 
with 21,255 participants. Sensitivity analyses confirmed these findings, 
highlighting a linear relationship between age and mortality in both groups. For 
each additional year of mean age, ICU mortality increased by 1.2% in non-COVID 
ARDS and 1.9% in COVID ARDS.
CONCLUSIONS: The relationship between age and ICU mortality is linear and shows 
no inflection point. Consequently, no age cut-off can be recommended for 
determining patient eligibility for V-V ECMO.

© 2024. The Author(s).

DOI: 10.1186/s13054-024-05074-z
PMCID: PMC11348734
PMID: 39192302 [Indexed for MEDLINE]

Conflict of interest statement: The authors declare no competing interests."
39187535,"1. Sci Rep. 2024 Aug 26;14(1):19771. doi: 10.1038/s41598-024-68688-x.

Contributing factors to hypophosphatemia development in critically Ill 
ventilated patients: a retrospective cohort study.

Statlender L(#)(1)(2), Raphaeli O(#)(3)(4), Shochat T(5), Robinson E(6), 
Hellerman Itzhaki M(6)(3)(7), Bendavid I(6)(7), Fishman G(6)(7), Singer 
P(6)(3)(7), Kagan I(6)(3)(7).

Author information:
(1)Department of General Intensive Care, Rabin Medical Centre, Beilinson 
Hospital, Petah Tikva, Israel. liranst1@clalit.org.il.
(2)School of Medicine, Tel Aviv University, Tel Aviv, Israel. 
liranst1@clalit.org.il.
(3)Institute for Nutrition Research, Felsenstein Medical Research Centre, Petah 
Tikva, Israel.
(4)Industrial Engineering and Management, Ariel University, Ari'el, Israel.
(5)Statistical Consulting Unit, Rabin Medical Centre, Petah Tikva, Israel.
(6)Department of General Intensive Care, Rabin Medical Centre, Beilinson 
Hospital, Petah Tikva, Israel.
(7)School of Medicine, Tel Aviv University, Tel Aviv, Israel.
(#)Contributed equally

Hypophosphatemia (serum phosphate < 2.5 mg/dL) is a major concern when 
initiating nutritional support. We evaluated which factors contribute to 
hypophosphatemia development in critically ill patients, as well as the 
association between hypophosphatemia and mortality. A retrospective cohort study 
of patients who were ventilated for at least 2 days in a 16-bed mixed ICU. Data 
collected includes demographics, Acute Physiology & Chronic Health Evaluation 2 
(APACHE2) admission score, Sequential Organ Failure Assessment score at 24 h 
(SOFA24), hourly energy delivery, plasma phosphate levels during the first 2 
weeks of admission, ICU length of stay (LOS), length of ventilation (LOV), and 
mortality (ICU and 90 days). For the hypophosphatemia development model, we 
considered mortality as a competing risk. For mortality analysis, we used the 
Cox proportional hazards model considering hypophosphatemia development as a 
time-varying covariate. 462 patients were used in the analysis. 59.52% of the 
patients developed hypophosphatemia. Several factors were associated with a 
decreased risk of hypophosphatemia: age, BMI, pre-admission diabetes diagnosis, 
APACHE2, SOFA24, first kidney SOFA score, hospital admission time before ICU 
admission, and admission after liver transplantation. Admission due to trauma 
was associated with an increased risk of hypophosphatemia. Survival analysis 
with hypophosphatemia as a time-varying covariate showed a protective effect of 
hypophosphatemia from mortality (HR 0.447, 95% CI 0.281, 0.712). Age, APACHE2, 
and SOFA24 score were found to be significantly associated with ICU mortality. 
Fasting duration in the ICU before nutritional support initiation was not found 
to be significantly associated with hypophosphatemia. We examined several 
fasting intervals (12 h, 24 h, 36 h, 48 h, 60 h, 72 h). In each fast interval, 
we compared the prevalence of hypophosphatemia among patients who fasted the 
specified length of time, with those who did not fast for the same length of 
time. In each fasting interval, hypophosphatemia prevalence was lower in the 
fasting group compared to the non-fasting group. However, this difference was 
insignificant. BMI, APACHE2, and hospital LOS before ICU admission were 
inversely associated with hypophosphatemia development. Fasting for up to 72 h 
in the ICU before starting nutritional support did not affect hypophosphatemia 
occurrence. Hypophosphatemia was associated with lower mortality.

© 2024. The Author(s).

DOI: 10.1038/s41598-024-68688-x
PMCID: PMC11347557
PMID: 39187535 [Indexed for MEDLINE]

Conflict of interest statement: The authors declare no competing interests."
